{"as_of":"2026-09-28","mode":"replay","generated_at":"2026-10-18T08:43:12Z","latest_pass":"2026-09-12","pass_count":32,"offline":false,"durations_s":{"s04":7.163,"s06":1.674,"s07":0.95,"total":9.787},"sources":{"imagery":"sentinel-2-c1-l2a (Earth Search STAC)","weather":"NASA POWER daily (community AG); Open-Meteo previous-runs archive: forecast issued 2026-09-27, published before 6 am Central on 2026-09-28","fires":"NASA FIRMS VIIRS NRT (SNPP, NOAA-20, NOAA-21), area API"}}