{"as_of":"2026-10-18","mode":"live","generated_at":"2026-10-18T08:00:06Z","latest_pass":"2026-10-17","pass_count":38,"offline":true,"durations_s":{"s02":8.803,"s04":3.09,"s06":0.159,"s07":0.232,"total":12.284},"sources":{"imagery":"sentinel-2-c1-l2a (Earth Search STAC)","weather":"NASA POWER daily (community AG); Open-Meteo forecast","fires":"NASA FIRMS VIIRS NRT (SNPP, NOAA-20, NOAA-21), area API"}}